{
  "$comment": "발췌(excerpt) — design/TOKENS.json 의 핵심 토큰만. 값의 단일 출처. 순수 #000/#fff 없음(warm off-black/off-white). accent 1색(따뜻한 clay). Tailwind 기본 blue/violet 미사용. radius small / surface flat-with-border / shadow subtle.",
  "color": {
    "background": {
      "base": "#FBF8F3",
      "subtle": "#F4EFE7",
      "muted": "#ECE5D9"
    },
    "surface": {
      "default": "#FFFDF9",
      "raised": "#FFFFFE",
      "sunken": "#F1EBE0"
    },
    "text": {
      "primary": "#26201A",
      "secondary": "#5B5147",
      "muted": "#8A7E70",
      "inverse": "#FBF8F3"
    },
    "border": {
      "subtle": "#E7DECF",
      "default": "#DAD0BE",
      "strong": "#C3B59E"
    },
    "accent": {
      "default": "#B5572E",
      "hover": "#9C4824",
      "subtle": "#F3E2D7",
      "contrast": "#FFFDF9"
    },
    "semantic": {
      "success": "#4F7A4A",
      "success.surface": "#E7EFE2",
      "warning": "#B07A1E",
      "warning.surface": "#F6ECD6",
      "danger": "#A6402F",
      "danger.surface": "#F4E0DA",
      "info": "#3F6A72",
      "info.surface": "#E0ECEC"
    }
  },
  "typography": {
    "fontFamily": {
      "display": "\"Source Serif 4\", \"Noto Serif KR\", Georgia, serif",
      "body": "\"IBM Plex Sans\", \"Pretendard\", -apple-system, sans-serif",
      "mono": "\"IBM Plex Mono\", \"SF Mono\", ui-monospace, monospace"
    },
    "fontSize": {
      "xs": "12px",
      "sm": "13px",
      "base": "15px",
      "lg": "17px",
      "xl": "20px",
      "2xl": "25px",
      "3xl": "32px",
      "4xl": "40px"
    },
    "fontWeight": {
      "regular": "400",
      "medium": "500",
      "semibold": "600",
      "bold": "700",
      "black": "820"
    },
    "lineHeight": {
      "tight": "1.25",
      "normal": "1.5",
      "relaxed": "1.7"
    },
    "letterSpacing": {
      "tight": "-0.01em",
      "normal": "0",
      "wide": "0.02em"
    }
  },
  "spacing": {
    "0": "0",
    "1": "4px",
    "2": "8px",
    "3": "12px",
    "4": "16px",
    "5": "20px",
    "6": "24px",
    "8": "32px",
    "10": "40px",
    "12": "48px",
    "16": "64px"
  },
  "radius": {
    "none": "0",
    "sm": "3px",
    "md": "5px",
    "lg": "8px",
    "full": "9999px"
  },
  "shadow": {
    "none": "none",
    "sm": "0 1px 2px rgba(38, 32, 26, 0.06)",
    "md": "0 2px 6px rgba(38, 32, 26, 0.08)",
    "lg": "0 6px 16px rgba(38, 32, 26, 0.10)"
  },
  "borderWidth": {
    "none": "0",
    "hairline": "1px",
    "thin": "1.5px",
    "thick": "2px"
  },
  "breakpoint": {
    "mobile": "640px",
    "tablet": "1024px",
    "desktop": "1280px"
  },
  "motion": {
    "duration": {
      "fast": "120ms",
      "base": "200ms",
      "slow": "320ms"
    },
    "easing": {
      "standard": "cubic-bezier(0.2, 0, 0, 1)",
      "decelerate": "cubic-bezier(0, 0, 0, 1)",
      "accelerate": "cubic-bezier(0.3, 0, 1, 1)"
    }
  },
  "zIndex": {
    "base": "0",
    "dropdown": "10",
    "sticky": "20",
    "overlay": "30",
    "modal": "40",
    "toast": "50"
  }
}
