{
  "$comment": "admin-dashboard 디자인 토큰 (발췌). 색/간격/폰트/모서리의 단일 출처. 순수 #000/#fff 금지 — cool slate off-white/off-black. 강조색 1색(muted teal) 절제. 고밀도 compact 스케일, 각진 표(작은 radius), subtle elevation. 숫자는 tabular mono.",
  "color": {
    "background": {
      "base": "#F4F6F8",
      "subtle": "#EBEEF2",
      "muted": "#E0E5EA"
    },
    "surface": {
      "default": "#FBFCFD",
      "raised": "#FDFEFE",
      "sunken": "#EEF1F4"
    },
    "text": {
      "primary": "#1C232B",
      "secondary": "#4B5663",
      "muted": "#7B8794",
      "inverse": "#F4F6F8"
    },
    "border": {
      "default": "#D5DCE3",
      "strong": "#B4BFC9",
      "subtle": "#E5EAEF"
    },
    "accent": {
      "default": "#117A86",
      "hover": "#0D636D",
      "subtle": "#DCEFF1",
      "contrast": "#FBFCFD"
    },
    "semantic": {
      "success": "#1F7A4D", "successSurface": "#DEF1E6", "successText": "#12492E",
      "warning": "#A66A12", "warningSurface": "#F6E9D2", "warningText": "#623E0A",
      "danger": "#B23A2E", "dangerSurface": "#F6DEDB", "dangerText": "#6A1F18",
      "info": "#2A5C8A", "infoSurface": "#DCE7F2", "infoText": "#193A57"
    }
  },
  "typography": {
    "fontFamily": {
      "display": "\"Inter Tight\", \"Pretendard\", system-ui, sans-serif",
      "body": "\"Inter\", \"Pretendard\", system-ui, sans-serif",
      "mono": "\"JetBrains Mono\", ui-monospace, \"SFMono-Regular\", monospace"
    },
    "fontSize": {
      "xs": "0.6875rem", "sm": "0.75rem", "base": "0.8125rem", "lg": "0.9375rem",
      "xl": "1.0625rem", "2xl": "1.25rem", "3xl": "1.5625rem", "4xl": "1.9375rem"
    },
    "fontWeight": {
      "regular": 400, "medium": 500, "semibold": 600, "bold": 700, "black": 800
    },
    "lineHeight": { "tight": 1.2, "normal": 1.4, "relaxed": 1.55 },
    "letterSpacing": { "tight": "-0.01em", "normal": "0", "wide": "0.02em" }
  },
  "spacing": {
    "0": "0", "1": "2px", "2": "4px", "3": "6px", "4": "8px", "5": "12px",
    "6": "16px", "8": "20px", "10": "28px", "12": "36px", "16": "48px"
  },
  "radius": { "none": "0", "sm": "2px", "md": "4px", "lg": "6px", "full": "9999px" },
  "shadow": {
    "none": "none",
    "sm": "0 1px 1px rgba(28,35,43,0.05)",
    "md": "0 1px 3px rgba(28,35,43,0.10)",
    "lg": "0 6px 16px rgba(28,35,43,0.14)"
  },
  "borderWidth": { "hairline": "1px", "thin": "1px", "thick": "2px" },
  "breakpoint": { "mobile": "0px", "tablet": "640px", "desktop": "1024px" },
  "motion": {
    "duration": { "fast": "80ms", "base": "140ms", "slow": "220ms" },
    "easing": {
      "standard": "cubic-bezier(0.2, 0, 0, 1)",
      "decelerate": "cubic-bezier(0, 0, 0, 1)",
      "accelerate": "cubic-bezier(0.3, 0, 1, 1)"
    }
  },
  "zIndex": { "base": 0, "dropdown": 100, "sticky": 200, "overlay": 300, "modal": 400, "toast": 500 }
}
