{
  "$comment": "content-platform 디자인 토큰 (발췌). 색/간격/폰트/모서리의 단일 출처. 순수 #000/#fff 금지 — 따뜻한 amber-cream paper + warm-sepia ink. 잡지 마스트헤드 톤의 깊은 잉크블루(petrol) 강조 1색 — crm 의 warm clay 와 의도적으로 다른 hue 계열. display serif 는 high-contrast old-style(Fraunces) 로 crm 의 transitional serif(Source Serif 4) 와 구별. shadow none(잡지 톤, 떠다니는 카드 제거).",
  "color": {
    "background": {
      "base": "#F7F0E1",
      "subtle": "#EFE6D2",
      "muted": "#E6DBC2"
    },
    "surface": {
      "default": "#FCF7EC",
      "raised": "#FFFCF4",
      "sunken": "#ECE2CD"
    },
    "text": {
      "primary": "#241C14",
      "secondary": "#574B3B",
      "muted": "#897B64",
      "inverse": "#F7F0E1"
    },
    "border": {
      "default": "#D8C9A9",
      "strong": "#BBA77F",
      "subtle": "#E8DCC2"
    },
    "accent": {
      "default": "#1F4E5F",
      "hover": "#163B48",
      "subtle": "#D9E5E7",
      "contrast": "#FCF7EC"
    },
    "semantic": {
      "success": "#3F6B45", "successSurface": "#E2EDD9", "successText": "#27442C",
      "warning": "#9A6B16", "warningSurface": "#F2E6C8", "warningText": "#5C3F0C",
      "danger": "#9A3528", "dangerSurface": "#F1D9CF", "dangerText": "#5E1E16",
      "info": "#1F4E5F", "infoSurface": "#D9E5E7", "infoText": "#143540"
    }
  },
  "typography": {
    "fontFamily": {
      "display": "\"Fraunces\", \"Spectral\", \"Noto Serif KR\", Georgia, serif",
      "body": "\"Source Sans 3\", \"Pretendard\", system-ui, sans-serif",
      "mono": "\"IBM Plex Mono\", ui-monospace, monospace"
    },
    "fontSize": {
      "xs": "0.8125rem", "sm": "0.9375rem", "base": "1.0625rem", "lg": "1.25rem",
      "xl": "1.5rem", "2xl": "1.9375rem", "3xl": "2.5rem", "4xl": "3.25rem"
    },
    "fontWeight": {
      "regular": 400, "medium": 500, "semibold": 600, "bold": 700, "black": 800
    },
    "lineHeight": { "tight": 1.18, "normal": 1.5, "relaxed": 1.72 },
    "letterSpacing": { "tight": "-0.015em", "normal": "0", "wide": "0.04em" }
  },
  "spacing": {
    "0": "0", "1": "4px", "2": "8px", "3": "12px", "4": "16px", "5": "20px",
    "6": "24px", "8": "32px", "10": "40px", "12": "48px", "16": "64px"
  },
  "radius": { "none": "0", "sm": "3px", "md": "6px", "lg": "10px", "full": "9999px" },
  "shadow": {
    "none": "none",
    "sm": "0 1px 0 rgba(36,28,20,0.06)",
    "md": "0 1px 2px rgba(36,28,20,0.08)",
    "lg": "0 4px 12px rgba(36,28,20,0.10)"
  },
  "borderWidth": { "hairline": "1px", "thin": "1px", "thick": "2px" },
  "breakpoint": { "mobile": "0px", "tablet": "640px", "desktop": "1024px" },
  "motion": {
    "duration": { "fast": "120ms", "base": "200ms", "slow": "320ms" },
    "easing": {
      "standard": "cubic-bezier(0.2, 0, 0, 1)",
      "decelerate": "cubic-bezier(0, 0, 0, 1)",
      "accelerate": "cubic-bezier(0.3, 0, 1, 1)"
    }
  },
  "zIndex": { "base": 0, "dropdown": 100, "sticky": 200, "overlay": 300, "modal": 400, "toast": 500 }
}
